DBA,Owner / Community_Name,Location_Address,County,Total_#_Sites,House district,Senate district
CEDARBROOK ESTATES,P S F ASSOCIATES,"323 LEGRAND BLVD., WHITE LAKE TWP., MI 48383",OAKLAND,691,51,23
,"LEFFINGWELL ESTATES, LLC","595 S MERIDIAN RD, HUDSON MI 49247",LENAWEE,100,34,16
STERLING ESTATES,C E ASSOCIATES,"43475 LAGRAND, STERLING HEIGHTS, MI 48078",MACOMB,760,57,9
,CONTINENTAL ESTATES MI LLC,"41 REVERE, DAVISON, MI 48423",GENESEE,386,68,26
,"MELVINDALE MOBILE HOME PARK, INC","18630 DIX, MELVINDALE, MI 48122",WAYNE,59,3,1
HICKORY HILLS VILLAGE,HICKORY HILLS VILLAGE LLC,"10450 SIX MILE ROAD, BATTLE CREEK, MI 49017",CALHOUN,283,45,18
BROOKHAVEN PARK,CARRIAGE WAY MHP LLC,"4747 WEST RIVER DR, COMSTOCK PARK MI 49321",KENT,73,81,30
JUNES MOBILE VILLAGE,JUNES MOBILE HOME PARK LIMITED PARTNERSHIP,"395 LABADIE COURT, ECORSE, MI 48229",WAYNE,146,2,1
LAKEVIEW MOBILE HOME COURT,"LEBLANC FAMILY LTD PARTNERSHIP, THE","745 EAST HURON RIVER DRIVE, BELLEVILLE, MI 48111",WAYNE,60,31,4
INDIAN ACRES MOBILE HOME PARK,GERALD KOSTER,"770 129TH AVE. R#2, SHELBYVILLE, MI 49344",ALLEGAN,35,43,18
ALLEGAN MOBILE ESTATES,ALLEGAN MOBILE ESTATES LLC,"1260 LINCOLN ROAD, ALLEGAN, MI 49010",ALLEGAN,42,43,20
DEARBORN TRAILER PARK,DONALD W ARNEY,"21851 WEST WARREN, DEARBORN HEIGHTS, MI 48127",WAYNE,47,15,2
HOMECREST VILLA MOBILE HOME PARK,HOMECREST VILLA MHP LLC,"3382 MONROE ROAD, ALLEGAN, MI 49010",ALLEGAN,58,43,20
WHITE PINE ESTATES,SHARON JEAN ALTMAN,"PAUL DRIVE, MESICK, MI 49668",WEXFORD,33,101,36
BUENA VISTA ESTATES,SOUTHERN LLC,"17330 HONOR HWY, INTERLOCHEN, MI 49643",BENZIE,68,104,32
AUSABLE MOBILE HOME VILLAGE,HEZ PROPERTIES LLC,"331 FIRST ST, OSCODA, MI 48750",IOSCO,27,99,36
,"OAKFIELD MOBILE HOME PARK, LLC","12176 14 MILE ROAD, GREENVILLE, MI 48838",KENT,22,91,33
BEDFORD HILLS,NP BEDFORD HILLS LLC,"110 BEJAC CIRCLE DR, BATTLE CREEK, MI 49037",CALHOUN,340,44,18
LINCOLN ESTATES,"ASPEN HOLLAND ESTATES, LLC","1139 LINCOLN AVENUE, HOLLAND, MI 49423",ALLEGAN,192,86,31
,GRANITE WILLOW POINT LLC,"43400 LENFESTY, MT. CLEMENS, MI 48043",MACOMB,299,62,12
ANDREWS TRAILER COURT,GERALD KOSTER,"1202 WEST M-89, PLAINWELL, MI 49080",ALLEGAN,36,42,18
LEISURE VILLAGE,LEISURE VILLAGE MOBILE HOME PARK LLC,"5305 CIRCLE DR, BELMONT MI 49306",KENT,258,90,30
,DAVISON MOBILE HOME COMMUNITY,"10364 DAVISON ROAD, DAVISON, MI 48423",GENESEE,26,68,26
,TRADEWIND MOBILE HOME COURT,"12400 NORTH SAGINAW STREET, CLIO, MI 48420",GENESEE,29,69,27
,"METRO COMMONS ASSOCIATES, LLC","28745 VAN BORN ROAD, ROMULUS, MI 48174",WAYNE,225,26,4
JOHNSON VILLAGE MOBILE HOME PARK,DOUGLAS & JOHNSON MOBILE ASSOCIATES LTD,",",ALLEGAN,75,,
,"FLUSHING MOBILE COURT, INC","638 NORTH MCKINLEY ROAD, FLUSHING, MI 48433",GENESEE,59,69,27
GRAND MOBILE VILLAGE,ASPEN GRAND PROJECT LLC,"6500 DIVISION AVENUE, GRAND RAPIDS, MI 49508",KENT,328,79,20
,HIDDEN LAKE ESTATES MI LLC,"505 NORTH ROCHESTER ROAD, LEONARD, MI 48051",OAKLAND,269,66,24
,FLAMINGO TRAILER COURT INC,"22600 MIDDLEBELT RD, FARMINGTON HILLS, MI 48024",OAKLAND,226,18,6
,"CLINTONVILLA I, LLC","4871 CLINTONVILLE ROAD, CLARKSTON, MI 48346",OAKLAND,180,52,23
,"COLLEGE HEIGHTS ASSOCIATES, LLC","3501 AUBURN ROAD, AUBURN HEIGHTS, MI 48057",OAKLAND,162,101,36
,"ASPEN-ALPINE PROJECT, LLC","3800 FRUIT RIDGE ROAD, GRAND RAPIDS, MI 49504",KENT,403,90,30
"RIVERS EDGE, A QUIET COMMUNITY","PROGRESSIVE COMMUNITIES ECSC, LLC","60 HATHAWAY STREET, ST. CLAIR, MI 48054",ST CLAIR,51,63,25
,"APPLETREE ESTATES ASSOCIATES, LLC","1061 WILSON AVENUE, WALKER, MI 49504",KENT,238,84,30
,CRESTVIEW MANOR,"1485 RIDGEVIEW DR, LAPEER MI 48446",LAPEER,200,67,26
,OSSINEKE MOBILE HOME PARK LLC,"10409 WASHINGTON AVENUE, OSSINEKE, MI 49766",ALPENA,10,106,36
,PARKHURST ESTATES MHC,"1540 LAPEER RD., OXFORD, MI 48371",OAKLAND,320,66,24
,WASHINGTON MOBILE HOME PARK,"60630 VAN DYKE, WASHINGTON, MI 48094",MACOMB,107,66,24
,CARO ESTATES LLC,"885 S STATE STREET, CARO MI 48723",TUSCOLA,63,97,25
,KINGSBROOK MHC LLC,"4600 N VAN DYKE, ALMONT MI 48003",LAPEER,233,65,24
VILLAGE EAST MOBILE HOME PARK,ALLEGAN MOBILE ESTATES LLC,"1258 LINCOLN ROAD, ALLEGAN, MI 49010",ALLEGAN,94,43,20
,TWIN PINES MHC LLC,"2701 CALHOUN RD, ALBION MI 49224",CALHOUN,73,44,17
,RED RUN LLC,"1066 LINDA LANE, MADISON HEIGHTS MI 48071",OAKLAND,123,57,3
,"LITTLE VALLEY ESTATES, INC","20832 TUCK ROAD, FARMINGTON HILLS, MI 48024",OAKLAND,158,18,6
ECKERTS MOBILE HOME COURT,PATRICIA C ECKERT & MATTHEW WACHOSKI,"2324 ELEVEN MILE ROAD BOX 2, WARREN, MI 48091",MACOMB,77,14,3
COUNTRY ACRES MOBILE HOME PARK,COUNTRY ACRES PARTNERS LLC,"5904 142ND AVE, HOLLAND MI 49423",ALLEGAN,113,43,31
LAKESHORE VILLAGE MOBILE HOME PARK,KRISHAN KUMAR KALIA,"35922 E. JEFFERSON, HARRISON TWP., MI 48043",MACOMB,45,61,12
,WINDSOR FARMS MI LLC,"23680 SANDPIPER DRIVE, CLINTON TOWNSHIP, MI 48036",MACOMB,633,61,12
,PRESQUE ISLE ESTATES,"429 BALSAM, ROGERS CITY, MI 49779",PRESQUE ISLE,64,106,36
,BLUE SKY MOBILE HOME PARK LLC,"36530 JEFFERSON AVE, MT. CLEMENS, MI 48045",MACOMB,134,61,12
SHADY OAKS MOBILE HOME PARK,PETER F RUSKIEWICZ,"6168 W M-80, KINROSS MI 49752",CHIPPEWA,14,108,38
,MAYWOOD ESTATES LLC,"20741 TUCK ROAD, FARMINGTON, MI 48024",OAKLAND,34,18,6
BYRON CENTER,ASPEN BYRON PROJECT LLC,"2680 84TH STREET, BYRON CENTER, MI 49315",KENT,143,79,20
,SUN CUTLER LLC A MICHIGAN LLC,"6471 SO. DIVISION, GRAND RAPIDS, MI 49508",KENT,284,80,29
HOLTS MOBILE HOME COURT AND SALES,OTHIE L HOLT,"6576 N DORT HWY, FLINT, MI 48505",GENESEE,57,70,27
,PARKVIEW ESTATES-NORTH LLC,"3500 WEST JEFFERSON, TRENTON, MI 48183",WAYNE,65,27,4
SWARTZ CREEK MEADOWS,NEPTUNE ENTERPRISES LLC,"4101 SHERIDAN ROAD, LENNON, MI 48449",GENESEE,608,69,27
TIMBERLINE ESTATES,SUN SECURED FINANCING LLC,"260 PIN OAK DRIVE, COOPERSVILLE, MI 49404",OTTAWA,303,89,30
,SUNRISE ESTATES MANUFACTURED HOME COMMUNITY LLC,"10080 US 23 NORTH, ALPENA, MI 49707",ALPENA,12,106,36
,WINDMILL POINTE MHC LLC,"588 48TH SE, KENTWOOD MI 49508",KENT,334,80,29
CITY OF ROSE CITY TRAILER PARK,CITY OF ROSE CITY,"410 N. WILLIAMS STREET, ROSE CITY, MI 48654",OGEMAW,16,99,36
HAWAIIAN GARDENS,SUN SILVER STAR LLC,"4261 GRANGE HALL ROAD, HOLLY, MI 48442",OAKLAND,233,72,22
,DECKERVILLE ESTATES MHC LLC,"2451 BLACK RIVER ST, DECKERVILLE, MI 48427",SANILAC,43,98,25
,SOMERSET MOBILE HOME COMMUNITY LLC,"117 BURCH RD STE B, COLDWATER MI 49036",BRANCH,56,35,17
,NILES PINES ESTATES,"900 MOBILE BLVD., NILES, MI 49120",CASS,80,37,17
LINDEN MOBILE HOME PARK,LINDEN R JONES,"19350 STATE LINE RD, EDWARDSBURG, MI 49112",CASS,57,36,17
,WHITE CREEK COUNTRY ESTATES,"15851 WHITE CREEK AVENUE, CEDAR SPRINGS, MI 49319",KENT,177,91,33
WHITE LAKE MOBILE HOME VILLAGE,"SUN SECURED FINANCING, LLC","1415 FISK ROAD, WHITE LAKE, MI 48386",OAKLAND,315,51,23
KINGS COURT,SUN KING'S COURT II LLC,"1585 RAY BLVD, TRAVERSE CITY, MI 49686",GRAND TRAVERSE,803,103,37
,"ROMEO MOBILE MANOR, INC","400 NOTRE DAME BLVD., ROMEO, MI 48065",MACOMB,98,66,24
AVRA ESTATES II,ALAN KEITH AVRA,"27 W GARFIELD AVENUE, COLDWATER, MI 49036",BRANCH,33,35,17
,TROWBRIDGE COMMUNITY,"2467 108TH AVE LOT #1, OTSEGO MI 49078",ALLEGAN,14,39,18
,BASELINE ESTATES LLC,"117 WESLER DR LOT 50, GOBLES, MI 49055",ALLEGAN,75,39,18
PAW PAW LAKE MOBILE HOME PARK,PAW PAW LAKE MOBILE HOME PARK LIMITED PARTNERSHI,"5259 NORTH WATERVLIET RD, WATERVLIET, MI 49098",BERRIEN,49,39,20
TOPAZ ESTATES,COLORED STONE PROPERTIES LLC,"2100 135TH AVENUE, HOPKINS, MI 49328",ALLEGAN,46,43,20
MAPLE VIEW MOBILE HOME PARK,KENNETH R SANTI,"124 WARREN DR, CRYSTAL FALLS MI 49920",IRON,15,110,38
EVERGREEN MOBILE HOME COMMUNITY,BATTLE CREEK RENTALS LLC,"2096 N STATE RD, IONIA MI 48846",IONIA,109,78,33
WHITE BIRCH VILLAGE,PARRISH PROPERTIES VII,"W8095 SOUTH U.S. 2, IRON MT MI 49801",DICKINSON,249,110,38
,DUMONT CREEK INVESTORS LLC,"1925 LAURA ST, ALLEGAN, MI 49010",ALLEGAN,75,43,20
,WOODLAND ESTATES LLC,"6737 NORTHLAND DRIVE, ROCKFORD, MI 49341",KENT,170,90,30
CROSWELL ESTATES,JMC COMMUNITIES INC,"20 BLACK RIVER ROAD, CROSWELL, MI 48422",SANILAC,42,98,25
,STOLKHOLM LLC,"800 WEST MIER ROAD, SANFORD, MI 48657",MIDLAND,116,95,34
TOWN & COUNTRY,ASPEN TOWN & COUNTRY ASSOCIATES II LLC,"849 MANOR, TRAVERSE CITY, MI 49684",GRAND TRAVERSE,192,103,37
WOODLAND ESTATES MANUFACTURED HOUSING COMMUNITY,DAGENAIS REAL ESTATE INC,"1600 S 30TH ST, ESCANABA MI 49829",DELTA,226,108,38
EVERGREEN ESTATES,EVERGREEN MHP LLC,"2158 W CARO RD, CARO MI 48723",TUSCOLA,93,97,25
ALGOMA ESTATES MANUFACTURED HOME COMMUNITY,"ALGOMA ASSOCIATES, LLC","4456 13 MILE, ROCKFORD, MI 48341",KENT,343,90,30
SILVER CREEK ESTATES,SILVER CREEK ESTATES MHC,"627 WILLOW RD., LOT 101, MARQUETTE, MI 49855",MARQUETTE,104,109,38
KNOLLWOOD ESTATES,SUN KNOLLWOOD LLC,"4595 KNOLLWOOD DRIVE, ALLENDALE, MI 49401",OTTAWA,161,89,30
SUNNYSIDE PARK,CHIN INVESTMENTS ONE LLC,"2740 PACKARD, ANN ARBOR, MI 48108",WASHTENAW,53,33,15
WESTWOOD VILLAGE MOBILE HOME ESTATE,WESTWOOD VILLAGE INVESTMENT GROUP LLC,"3365 WEST PASADENA, FLINT, MI 48504",GENESEE,152,69,27
,"SOUTH LYON WOODS ASSOCIATES, LLC","530 LANIER, SOUTH LYON, MI 48178",OAKLAND,211,23,23
ALANS PARK,RICHARD VAN GILDER,"3575 NICHOLSON RD, FOWLERVILLE, MI 48836",LIVINGSTON,199,50,22
,GRANITE ROBBINWOOD VILLA LLC,"26115 THIRD STREET, TAYLOR, MI 48180",WAYNE,269,29,1
,ORCHARD GROVE HOLDINGS LLC,"2835 SOUTH WAGNER #200, ANN ARBOR, MI 48103",WASHTENAW,290,33,14
,SYLVAN VALLEY ESTATES INC,"46537 ECORSE, BELLEVILLE, MI 48111",WAYNE,37,31,4
SANDY PINES TRAILER PARK,BRIAN R MASTAW,"95 W. 15 MILE RD., LOT #23, SAULT STE. MARIE, MI 49783",CHIPPEWA,14,107,37
,"BIRCHCREST ESTATES MHC, LLC","2330 E. MAIN ST., NILES, MI 49120",BERRIEN,110,37,17
SUN CAMELOT VILLA,SUN CAMELOT VILLA LLC,"17111 HALL ROAD, MACOMB, MI 48044",MACOMB,712,60,11
,"NORTH SHORE MHC, LLC","17990 NORTH SHORE ROAD, FERRYSBURG, MI 49409",OTTAWA,96,88,31
KENSINGTON PLACE,KENSINGTON PARK LTD,"60501 GRAND RIVER AVENUE, NEW HUDSON, MI 48165",OAKLAND,488,49,23
LAKEVIEW MOBILE HOME PARK,JMC COMMUNITIES INC,"5767 MAIN STREET, LEXINGTON, MI 48450",SANILAC,38,98,25
,LARRYS TRAILER COURT,"10692 N BLACK RIVER RD., CHEBOYGAN, MI 49721",CHEBOYGAN,8,106,37
,GRANITE ROBBINWOOD VILLA LLC,"7550 BEECH DALY, TAYLOR, MI 48180",WAYNE,114,29,1
,TAG A LONG LLC,"6609 S. RIVER RD., MARINE CITY, MI 48039",ST CLAIR,38,63,25
,COUNTRY MANOR,"5649 S. VERNON RD., DURAND, MI 48429",SHIAWASSEE,44,71,28
SYCAMORE VILLAGE,SYCAMORE VILLAGE MOBILE HOME PARK LLC,"900 W COLUMBIA ST, MASON, MI 48854",INGHAM,449,73,21
,"STODDARD MOBILE COURT & SALES, INC","16940 SOUTH OAKLEY ROAD, CHESANING, MI 48616",SAGINAW,125,71,34
,WEBBERVILLA LLC,"400 WEST GRAND RIVER AVENUE, WEBBERVILLE, MI 48892",INGHAM,174,73,22
GRIEVES TRAILER PARK,MKG PRPERTIES LLC,"178 WASHINGTON STREET, SARANAC, MI 48881",IONIA,4,78,18
,SUN HAWAIIAN HOLLY LLC A MICHIGAN LLC,"4041 GRANGE HALL ROAD, HOLLY, MI 48442",OAKLAND,192,72,22
WHITE PINES MOBILE HOME PARK,JOEL E REINOEHL,"29530 M-152, DOWAGIAC, MI 49047",CASS,36,37,17
,CREEKSIDE MEADOWS OF ST JOHNS MHC LLC,"2265 WEST PARKS ROAD - LOT 1, ST. JOHNS, MI 48879",CLINTON,216,75,28
,LONG LAKE MOBILE HOME PARK LLC,"2701 WEST LONG LAKE ROAD, ORLEANS, MI 48865",IONIA,27,91,33
,LAKESHORE ESTATES,"8924 WEST LONG LAKE ROAD, ALPENA, MI 49707",ALPENA,58,106,36
LAKEVIEW MOBILE HOME PARK,SUN LAKEVIEW LLC,"9910 GERALDINE STREET, YPSILANTI, MI 48197",WASHTENAW,392,32,15
,AVRA ESTATES,"415 WEST CHICAGO ROAD, COLDWATER, MI 49036",BRANCH,62,35,17
SEAWAY TRAILER COURT,"SEAWAY TRAILERS, LLC","9708 NORTH RIVER ROAD, ALGONAC, MI 48001",ST CLAIR,12,63,12
FOUR KORNERS MOBILE HOME PARK,JAMES B ERICKSON,"100 TAYLOR ROAD, GWINN, MI 49841",MARQUETTE,14,109,38
DUNLOPS ORCHARD PARK,PHYLLIS E ROGERS,"12703 WEST PINE LAKE ROAD, PLAINWELL, MI 49080",BARRY,22,43,18
,"ALPINE MOBILE VILLAGE, INC","4840 ALPINE AVENUE NW, COMSTOCK PA 49321",KENT,118,90,30
,BIRCHGROVE MOBILE HOME COMMUNITY,"500 PIONEER ROAD, MARQUETTE, MI 49855",MARQUETTE,77,109,38
COUNTRY VILLAGE MOBILE HOME ESTATES,HELMUT K UNGER,"7781 WEST GRAND RIVER, GRAND LEDGE, MI 48837",CLINTON,75,77,28
COUNTRY VILLAGE ESTATES,COUNTRYSIDE VILLAGE GROUP LTD,"2701 I-75 BUSINESS LOOP, WEST BRANCH MI 48661",OGEMAW,53,99,36
COLONIAL MANOR MANUFACTURED HOME COMMUNITY,"COLONIAL MANOR ASSOCIATES, LLC","5500 WEST K L AVENUE, KALAMAZOO, MI 49009",KALAMAZOO,193,40,19
,COACHMANS COVE LIMITED PARTNERSHIP,"6600 PORTAGE LAKE ROAD, MUNITH, MI 49259",JACKSON,250,48,14
,CLIMAX MOBILE HOME PARK INC,"14253 EAST ON AVENUE, CLIMAX, MI 49034",KALAMAZOO,75,45,18
,HILLCREST ACRES ASSOCIATES LLC,"3205 DOUGLAS AVE, KALAMAZOO MI 49007",KALAMAZOO,150,41,19
,HILLANLAKE VILLAGE MOBILE HOME PARK,"3998 SUNSET DRIVE, BROOKLYN, MI 49230",JACKSON,149,47,14
,"SPRING VALLEY ESTATES, INC","121 SPLIT RAIL TRAIL, HANOVER, MI 49241",JACKSON,94,45,14
GLENVIEW MOBILE HOME PARK,DANIEL FRAZER,"4090 JACKSON RD, SARANAC, MI 48881",IONIA,13,78,18
DORSEY'S ON GLEN LAKE,NAAD PROPERTIES LLC,"8648 S. DORSEY PARK RD., EMPIRE, MI 49630",LEELANAU,31,103,37
COLONIAL ACRES MANUFACTURED HOME COMMUNITY,COLONIAL ACRES ASSOCIATES LLC,"5374 DEADWOOD DR, KALAMAZOO MI 49002",KALAMAZOO,612,41,19
,GRAND OAKS VILLAGE LLC,"817 NORTH CLINTON, GRAND LEDGE, MI 48837",EATON,168,77,21
GLENN WOOD MOBILE VILLAGE,GLENN WOOD MOBILE ASSOCIATES,"2526 MORRISSEY, WARREN, MI 48090",MACOMB,147,14,3
,"HIGHLAND HILLS, INC","398 SECOND ST, ST. IGNACE, MI 49781",MACKINAC,35,107,37
MOBILEHOME BEACH,MILO ALLETT,"92441 LAKE SHORE DR, LAWTON, MI 49065",VAN BUREN,29,39,20
LAWRENCE MOBILE HOME PARK,"MAPLE HILL MOBILE HOME PARK, LLC","175 CORWIN, LAWRENCE, MI 49064",VAN BUREN,60,39,20
KLINES RESORT & MOBILE HOME PARK,"KLINES RESORT, LTD","22460 KLINES RESORT RD R#2, THREE RIVERS MI 49093",ST JOSEPH,159,36,17
,HICKORY LANE MOBILE HOME PARK LLC,"14809 W-M60, THREE RIVERS MI 49093",ST JOSEPH,32,36,17
COLONIAL ESTATES MANUFACTURED HOME COMMUNITY,CELINE DEVELOPMENTS LLC,"501 N US WAY 131 #9, WHITE PIGEON MI 49099",ST JOSEPH,112,36,17
,COLONIAL ACRES MOBILE HOME PARK & SALES,"24995 US 12 EAST, EDWARDSBURG, MI 49112",CASS,106,36,17
,WHISPERING PINES TRAILER PARK,"240 S MT TOM RD, MIO MI 48647",OSCODA,9,105,36
,BARRYS RESORT INC,"2875 SOUTH CHARLTON PARK ROAD, HASTINGS, MI 49058",BARRY,50,78,18
,HALF MOON LAKE RESORT,"2832  STAINES RD. S.E., STANTON, MI 48888",MONTCALM,6,91,33
,LESLIES MOBILE HOME VILLAGE,"25214 GRATIOT, ROSEVILLE, MI 48066",MACOMB,166,12,11
LAKEVIEW MOBILE HOME ESTATES,DANIEL R OCONNOR,"R#2 INDIAN LAKE, EAU CLAIRE, MI 49111",CASS,18,37,17
,TIMBERLINE ESTATES MOBILE HOME PARK,"2315 EAST RIVER ROAD, TWIN LAKE, MI 49457",MUSKEGON,302,87,32
"OAKS MOBILE HOME PARK, THE",OAKTRAIL ASSOCIATES,"3240 GETTY STREET, MUSKEGON, MI 49444",MUSKEGON,172,20,32
APPLE CARR VILLAGE,APPLE CARR VILLAGE MOBILE HOME PARK LLC,"516 COURTLAND, MUSKEGON, MI 49442",MUSKEGON,716,89,32
WESTPHALIA TRAILER COURT,PATRICIA HENGESBACH,"13606 JASON RD., WESTPHALIA MI 48894",CLINTON,8,77,28
WILLOW GREEN MOBILE HOME COMMUNITY,"LAWSON VILLAGE, LLC","2033 N OUTER DR, MONROE MI 48161",MONROE,586,30,16
MEADOWBROOK ESTATES MANUFACTURED HOME COMMUNITY,"SUN POOL 3, LLC","1250 STRANDWYCK, MONROE, MI 48161",MONROE,455,30,16
,INVERNESS COMMUNITY LLC,"6230 LEWIS, TEMPERENCE MI 48182",MONROE,518,30,16
ALLENDALE MEADOWS,SUN SECURED FINANCING LLC,"11400 BOYNE BLVD., ALLENDALE, MI 49401",OTTAWA,352,89,30
,HOLIDAY HAVEN TRAILER PARK ASSOCIATION,"2250 OTTAWA BEACH ROAD, HOLLAND, MI 49424",OTTAWA,45,86,31
MAPLE VIEW,MAPLE PARKS LLC,"1984 92ND AVENUE, ZEELAND, MI 49464",OTTAWA,93,85,31
MICHIANA MOBILE HOME PARK,NOTTAWA ESTATES LLC,"135 SOUTH NOTTAWA, NOTTAWA, MI 49075",ST JOSEPH,40,36,17
,"PINE ISLAND LAKE RECREATION PARK, INC","3768 PINE ISLAND DR., LOT 9, HOLTON, MI 49425",MUSKEGON,30,102,32
WHISPERING PINES ESTATES,WALTER SCHEWE,"R#4 PHOENIX ROAD, SOUTH HAVEN, MI 49090",VAN BUREN,50,38,20
LEXINGTON NORTH SHORES,VILLAGE OF LEXINGTON,"5203 MAIN STREET, LEXINGTON, MI 48450",SANILAC,232,98,25
,NORTHLAND ACRES MHC,"13323 NORTHLAND DRIVE, CEDAR SPRINGS, MI 49319",KENT,71,91,33
,LA-E-MA LAND MOBILE HOME PARK INC,"7825 CANNONSBURG ROAD, ROCKFORD, MI 49341",KENT,29,90,33
,RUSH LAKE MOBILE HOME PARK & CAMP LLC,"48401 RUSH LAKE RD LOT 1, HARTFORD, MI 49057",VAN BUREN,20,39,20
WEST POINT HILLS,CREEKSIDE WEST POINT HILLS LLC,"24878 25TH STREET, MATTAWAN, MI 49071",VAN BUREN,377,39,19
WINDMILL PARK,THEROUX DEVELOPMENT COMPANY,"1433 EIFERT ROAD, HOLT, MI 48842",INGHAM,484,74,21
VALLEY SPRINGS MOBILE HOME PARK,VALLEY SPRINGS MOBILE HOME PARK LLC,"4723 NORTH HARTEL ROAD, POTTERVILLE, MI 48876",EATON,81,76,21
FLAT ROCK VILLAGE,"TRI-PARK HOLDINGS, LLC","11150 TELEGRAPH ROAD, CARLETON, MI 48117",MONROE,332,29,32
,MICHAEL R ANDREE,"7725 SUMMERFIELD RD, LAMBERTVILLE MI 48144",MONROE,28,30,16
FAIRVIEW ESTATES,"DAGENAIS REAL ESTATE, INC","1401 NORTH 23RD STREET, ESCANABA, MI 49829",DELTA,154,108,38
,RIVERVIEW HOLDINGS LLC,"3460 47TH ST APT 12, HAMILTON MI 49419",ALLEGAN,50,43,20
MARLIN VILLAGE MOBILE HOME PARK,NILES MOBILE HOME PARK INC,"2995 DETROIT RD, NILES MI 49120",CASS,38,37,17
,"ARLINGTON ESTATES, LLC","3785 EVANSTON AVE, MUSKEGON MI 49442",MUSKEGON,660,87,32
B-24 MOBILE HOME PARK,"VSC PROPERTY MANAGEMENT, LLC","4785 MUNGER RD, YPSILANTI, MI 48197",WASHTENAW,20,32,15
RUDGATE MANOR MOBILE HOME PARK,RUDGATE VILLAGE COMPANY LTD,"5150 RUDGATE BLVD, STERLING HEIGHTS, MI 48078",MACOMB,931,57,9
PRESIDENTIAL ESTATES,SUN SECURED FINANCING LLC,"5075 PRESIDENTIAL LANE, HUDSONVILLE, MI 49426",OTTAWA,364,85,31
,MEMORY LANES MOBILE HOME PARK LLC,",",ST JOSEPH,227,,
EMERALD ESTATES,COLORED STONES PROPERTIES LLC,"236 JONES ST, GRANT, MI 49327",NEWAYGO,31,101,33
,"ROB-ANN MOBILE HOME COURT, LLC","1215 LOCUST STREET, FREMONT, MI 49412",NEWAYGO,84,101,33
MEADOWVIEW VILLAGE MOBILE HOME PARK,AN-WIL INC,"1307 LOCUST STREET, FREMONT, MI 49412",NEWAYGO,86,101,33
,FREMONT HILLS PARK LLC,"927 LAKE DRIVE, FREMONT, MI 49412",NEWAYGO,55,101,33
RILEYS MOBILE HOME COURT,"YOUNG PROPERTY MANAGEMENT, INC","3700 NORTH HILLSDALE ROAD, HILLSDALE, MI 49242",HILLSDALE,28,35,16
EVERGREEN ESTATES MOBILE HOME PARK,RRR ENTERPRISES LLC,"532 WEST CHICAGO ROAD, JONESVILLE, MI 49250",HILLSDALE,108,35,16
,"CRYSTAL DOWNS MHC, LLC","2701 CRYSTAL LAKE ROAD, WHITEHALL, MI 49461",MUSKEGON,104,102,32
,"OAKWOOD HEIGHTS MOBILE HOME PARK, LTD","1625 VINECROFT NW, GRAND RAPIDS, MI 49504",KENT,43,84,30
GLEN-AIRE MOBILE HOME PARK,"GLEN-AIRE, LLC","1153 WEST GLENLORD ROAD, ST. JOSEPH, MI 49085",BERRIEN,130,38,20
NORTH SHORES ESTATES MOBILE HOME PARK,THE RADA GROUP LLC,"1565 M-63 NORTH #33, BENTON HARBOR, MI 49022",BERRIEN,99,38,20
,LAKESHORE ESTATES MHC LLC,"3017 JOHNSON RD, STEVENSVILLE, MI 49127",BERRIEN,106,38,20
,THE VILLAGE GREEN OF GRAND HAVEN LLC,"1700 ROBBINS RD. #301, GRAND HAVEN, MI 49417",OTTAWA,391,88,31
LOMBARDINI TRAILER PARK,ROBERT L LOMBARDINI,"1228 M-89 WEST, PLAINWELL, MI 49080",ALLEGAN,50,42,18
BROOMFIELD VALLEY MOBILE HOME PARK,TED LUEDER,"6553 WEST REMUS ROAD, MT. PLEASANT, MI 48858",ISABELLA,127,92,34
FRENCHTOWN VILLA,"R E FUND NEWPORT, LLC","1250 PAREE AVENUE, NEWPORT, MI 48166",MONROE,749,28,16
CLARKSTON LAKES MOBILE HOME COMMUNITY,C LAKE CLARKSTON ASSOCIATES,"4260 DOGWOOD BOULEVARD, CLARKSTON, MI 48016",OAKLAND,498,66,24
MAPLE HILL VILLAGE,MAPLE HILL MOBILE HOME PARK LLC,"100 MAPLE HILL, HARTFORD MI 49057",VAN BUREN,99,39,20
COUNTRY VILLAGE MHP,HEMLOCK HOLDINGS LLC,"14624 32ND AVENUE, MARNE, MI 49435",OTTAWA,31,89,30
,WOLF LAKE ESTATES,"24054 M-43 HWY, MATTAWAN MI 49071",VAN BUREN,41,39,20
COUNTRYSIDE MOBILE PARK,"LMCO, INC","191 NORTH FILLMORE ROAD, COLDWATER, MI 49036",BRANCH,24,35,17
,MITCHELL BROS MOBILE HOME PARK,"03750 67TH STREET, SOUTH HAVEN, MI 49090",VAN BUREN,49,39,20
KEY HEIGHTS VILLAGE,"LOWELL MHP, LLC","11335 EAST FULTON, LOWELL, MI 49331",KENT,286,78,18
,KENT CITY MHC LLC,"135 SOUTH MAIN, KENT CITY, MI 49330",KENT,74,89,33
EAGLE LAKE ESTATES MOBILE HOME PARK,REMA VILLAGE MOBILE HOME PARK LTD,"24050 NORTH SHORE DR #93, EDWARDSBURG MI 49112",CASS,92,36,17
,VILLA MI LLC,"3096 CAMELOT DR, FLINT MI 48507",GENESEE,319,70,27
HI-WAY MOBILE HAVEN,"GERALD D HARRIS, INC","2600 LANSING ROAD, CHARLOTTE, MI 48813",EATON,67,76,21
DOUGLAS MOBILE ESTATES,DOUGLAS-JOHNSON MOBILE ASSOCIATES LTD,",",ALLEGAN,97,,
,LILLY BANKS LANE,"13400 CORNELL RD, CONCORD MI 49237",JACKSON,19,45,17
,TWIN PINES MOBILE HOME PARK,"1766 RAU RD, WEST BRANCH, MI 48661",OGEMAW,33,99,36
,ASPEN-BRENTWOOD PROJECT LLC,"198 FESCUE S.E., KENTWOOD, MI 49548",KENT,195,80,29
CLIFF VIEW TRAILER PARK,JAMES P MONTELLA,"3200 NORTH M-63, BENTON HARBOR, MI 49022",BERRIEN,10,38,20
,WALNUT TRAILER PARK,"4118 SOUTH SEEGER STREET, CASS CITY MI 48726",TUSCOLA,14,98,25
WELLERS TRAILER PARK,JO A CARNEY,"8928 66TH STREET, ALTO, MI 49302",KENT,21,79,18
HURON SHORES MANUFACTURED HOME COMMUNITY,CREEKSIDE HURON SHORES LLC,"144 SHORELINE EAST, PORT SANILAC, MI 48469",SANILAC,192,98,25
,NORTHERN MICHIGAN PARTNERS LLC,"220 HIAWATHA DR, IRON RIVER MI 49935",IRON,21,110,38
,WHISPERING PINES MOBILE HOME PARK,"8741 0.8 LANE, GLADSTONE, MI 49837",DELTA,6,108,38
,PHOENIX MOBILE HOME COURT LLC,"15011 WEST MICHIGAN, MARSHALL, MI 49068",CALHOUN,33,45,18
,SANDS TRAILER COURT LLC,"110 S STATE HWY M553, GWINN MI 49841",MARQUETTE,14,109,38
SHANGRI LA VILLAGE MOBILE HOME COMMUNITY,SHANGRI-LA PARTNERS LLC,"6900 SOUTH RIVER ROAD, MARINE CITY, MI 48039",ST CLAIR,271,63,25
HIGHLAND HILLS ESTATES,HIGHLAND HILLS ESTATES ASSOCIATES,"25600 SEELEY, NOVI, MI 48050",OAKLAND,198,21,13
NOTTINGHAM FOREST MHC,PURITAN HOLDINGS LLC,"1665 M32 WEST, GAYLORD, MI 49735",OTSEGO,74,105,36
CLOVER ESTATES MOBILE HOME PARK,CLOVER ESTATES LC,"3239 CLOVER PARKWAY, MUSKEGON, MI 49444",MUSKEGON,223,89,32
,PARIS ESTATES LLC,"310 48TH STREET, S.E., GRAND RAPIDS, MI 49548",KENT,155,80,29
BIG TREES MOBILE HOME PARK,ASTER INVESTMENTS INC,"28433 JOY RD, WESTLAND MI 48185",WAYNE,67,25,5
VILLAGE ESTATES MHP,"CARTER HAWKINS, LLC","2580 HOLMES, YPSILANTI, MI 48197",WASHTENAW,75,32,15
FENNERS MOBILE VILLAGE,JAMES A RADATZ,"4172 LAPEER ROAD, PORT HURON, MI 48060",ST CLAIR,35,64,25
,VANS MOBILE HOME PARK,"9720 EAST LANSING RD, DURAND MI 48429",SHIAWASSEE,14,71,28
,QUIET COVE,"12675 COLBY LAKE ROAD, LAINGSBURG, MI 48848",SHIAWASSEE,44,75,28
,COUNTRYSIDE VILLAGE MI LLC,"4600 W. BRITTON ROAD, PERRY, MI 48872",SHIAWASSEE,360,71,28
,BIG RAPIDS MOBILE HOME COURT,"606 BJORNSON STREET, BIG RAPIDS, MI 49307",MECOSTA,137,100,34
,"HAVEN VIEW MOBILE HOME COURT, INC","18505 NORTHLAND DRIVE, BIG RAPIDS, MI 49307",MECOSTA,80,100,34
,RAVINE VIEW ESTATES MHC LLC,"5100 LITTLE PAW PAW LAKE ROAD, COLOMA, MI 49038",BERRIEN,160,39,20
,SELKIRK LAKE MOBILE HOME PARK,"780 127TH AVENUE, SHELBYVILLE, MI 49344",ALLEGAN,25,43,18
CANDLE WICK COURT,UMH SALES AND FINANCE INC,"1800 CANDLEWICK DRIVE, OWOSSO, MI 48867",SHIAWASSEE,211,71,28
TELA VALLEY MHC,GRANITE TELA VALLEY LLC,"17707 TELEGRAPH ROAD, ROMULUS, MI 48174",WAYNE,487,28,4
VACATION VILLAGE MOBILE HOME PARK,VACATION VILLAGE INC,"509 LAKE, ELK RAPIDS, MI 49629",ANTRIM,64,104,37
,SUNSET ESTATES OF GAYLORD LLC,"7345 MILL STREET, VANDERBILT, MI 49795",OTSEGO,20,105,36
,LAKEWOOD MOBILE HOME PARK LLC,"SANDS STREET AT RUSH STREET, PENTWATER, MI 49449",OCEANA,40,102,32
,"HYLANDER VALLEY, INC","271 N. EASTWOOD, HART, MI 49420",OCEANA,63,102,32
,"WATER WHEEL MOBILE HOME ESTATES, INC","316 WEST MICHIGAN AVENUE, CLINTON, MI 49236",LENAWEE,172,33,15
,"COACH LIGHT ESTATES, INC","650 W ADRIAN ST LOT 176, BLISSFIELD, MI 49228",LENAWEE,235,34,16
MALL MOBILE PARK,"CASTLE INSULATION, INC","20 NORTH TILDEN, PONTIAC, MI 48328",OAKLAND,41,53,23
,"SILVER SHORES MHC, LLC","1266 CARL ROAD, TRAVERSE CITY, MI 49684",GRAND TRAVERSE,200,104,37
,WARWICK VILLAGE MHP,"24600 JOY ROAD BLDG. #153, REDFORD, MI 48239",WAYNE,151,16,6
STRATFORD VILLA MOBILE HOME PARK,STRATFORD VILLA ASSOCIATES LTD,"3333 STRATFORD WAY, WIXOM, MI 48076",OAKLAND,409,49,23
WILLOW TREE VILLAGE,AMERICAN WILLOW TREE LIMITED PARTNERSHIP,"3840 N RIATA DRIVE, BAY CITY, MI 48706",BAY,78,96,35
COUNTRY ACRES MANUFACTURED HOME COMMUNITY,ASPEN COUNTRY PROJECT LLC,"300 KRISTY JO, CADILLAC, MI 49601",WEXFORD,182,101,36
,COUNTRY ESTATES OWNER LLC,"4461 CLYDE PARK SW, GRAND RAPIDS, MI 49509",KENT,160,83,29
MAPLE GROVE MOBILE HOME COMMUNITY,COSMONET LLC,"G-4493 FENTON ROAD, BURTON, MI 48529",GENESEE,101,70,27
,"NORTHERN ESTATES SOUTH, LLC","1340 POST ROAD, BELMONT, MI 49306",KENT,259,90,30
,LAPEER MEADOWS MHC LLC,"1265 FARNSWORTH RD, LAPEER MI 48446",LAPEER,230,67,26
WENONA BEACH ESTATES,WENONA LTD,"4444 NATIONAL AVENUE, BAY CITY, MI 48706",BAY,182,96,35
,"HOLIDAY VILLAGE OF SCOTTVILLE, INC","1701 W. U.S. 10, SCOTTVILLE, MI 49454",MASON,74,102,32
BARODA ESTATES,BARODA ESTATES LLC,"8836 STEVENSVILLE BARODA RD #7, BARODA, MI 49101",BERRIEN,152,37,17
YOUNGS TRAILER PARK,TIM HANDY,"521 E CHURCH ST, REED CITY MI 49677",OSCEOLA,17,100,34
EVART TRAILER COURT,FRANCISCO J CATALDO,"201 FAIR, EVART, MI 49631",OSCEOLA,20,100,34
,HOLIDAY MANOR PARK LLC,"5656 TRAILER PARK DR, JACKSON MI 49202",JACKSON,63,46,14
,PLYMOUTH HILLS MANUFACTURED HOME COMMUNITY LLC,"14201 RIDGE RD, PLYMOUTH MI 48170",WAYNE,635,23,13
TALLGRASS ESTATES,FR COLDWATER LLC,"260 EAST GARFIELD AVENUE, COLDWATER, MI 49036",BRANCH,239,35,17
HAMLIN MHC,"SUN POOL 12, LLC","5325 VAN ORDEN ROAD, WEBBERVILLE, MI 48892",INGHAM,230,73,22
,DAVISON EAST MI LLC,"11100 DAVISON RD, DAVISON MI 48423",GENESEE,190,68,26
BROADVIEW ESTATES,SUN CONTINENTAL NORTH LLC,"4250 NORTH STATE, DAVISON, MI 48423",GENESEE,474,67,26
CADILLAC LEISURE MOBILE HOME PARK,CADILLAC LEISURE PARTNERS LLC,"114 B STREET, CADILLAC, MI 49601",WEXFORD,98,101,36
NORTHERN COUNTRY ESTATES,NORTHERN COUNTRY ESTATES LLC,"1030 M-76, ALGER, MI 48610",ARENAC,40,99,36
TAMARAC VILLAGE,TAMARAC VILLAGE MOBILE HOME PARK LLC,"2875 NORTH LAKESHORE DRIVE, LUDINGTON, MI 49431",MASON,349,102,32
,HESS LAKE RV & MOBILE HOME PARK LLC,"825 EAST 88TH STREET, NEWAYGO, MI 49337",NEWAYGO,65,101,33
,"BRIGHTON VILLAGE ASSOCIATES, LLC","7500 GRAND RIVER, BRIGHTON, MI 48116",LIVINGSTON,196,48,22
,WOLF LAKE MOBILE HOME PARK INC,"3286 WOLF LAKE DRIVE, BALDWIN, MI 49304",LAKE,31,101,33
